Video ID,Title,Upload Date,Video Type,Duration,Duration in s,View Count,Like Count,Comment Count
dU_dDHh_LMY,The doctor said I need to eat more fish…,2022-02-18,Short,15S,15,5705551,317509,2334
MY9l1G6aT_I,The time I got stood up on a date 💔,2022-02-14,Short,1M,60,43669471,3155362,8855
6iPbI3HAUEo,A Big Brisket Sandwich,2022-02-11,Short,21S,21,2449810,158682,1083
0y2ntUU5n04,Car Cooking: Red Lobster @NickDiGiovanni,2022-02-08,Short,57S,57,25287768,2032880,4929
WEfbBm7qTUE,The sandwich from my nightmares,2022-02-07,Short,25S,25,2467169,191503,1101
NqHZXM3RB9Q,The day I fell in love,2022-02-04,Short,1M,60,49184409,3033421,8416
gAEAVA9Ippg,Steak Battles: Max vs Ken’s (cops called👮‍♂️),2022-01-29,Short,56S,56,33893091,2553536,6529
Ms7gIC6i_sA,Duck Fat Chip 🦆,2022-01-26,Short,42S,42,14820057,834315,3213
czKXBBUezps,The Ultimate Smash Burger,2022-01-25,Short,47S,47,3097813,274123,1356
k-kEgO4WkeE,Pork Belly Bread 🐷,2022-01-22,Short,40S,40,5113737,402231,1774
gPGAIx2wC40,28 Day Salt Dry Age 🧂,2022-01-20,Short,34S,34,8119397,632014,1142
MshH6ajPKP4,Butter Injected Lobster 🦞,2022-01-17,Short,34S,34,74108886,3482222,19986
YB3hofmgZLo,Homemade McFish,2022-01-15,Short,29S,29,1409289,121586,384
WpGrl1-GZMA,Chicken and Waffles x TikTok Cake #shorts,2022-01-14,Short,39S,39,10844995,707602,1850
JUFf5yrZDbA,How did I make money living in China? Ft. Every TikTok creator seasoning #shorts,2022-01-07,Short,1M,60,37460425,2578256,8002
rGoZfebxjVI,Tofu Ribs (for all my loyal vegan followers) #shorts,2022-01-06,Short,16S,16,10398863,576226,9110
R6T3D6gu1GI,Has social media made me hate cooking? #shorts,2022-01-03,Short,1M,60,3131863,231770,1391
bMC13z2GCqc,Best “it’s raw” comment wins (pt 2) #shorts,2021-12-30,Short,12S,12,4928055,204173,12905
5GaIEvusqbU,Steak Ice Cream #shorts,2021-12-28,Short,11S,11,19651524,636793,3652
gAj7I7nt_XA,Prime Rib Reuben #shorts,2021-12-26,Short,21S,21,2215189,141570,723
Hkg2e_9PjMI,What happens if you don’t rest your roast? #shorts,2021-12-25,Short,24S,24,11176696,523451,3899
l9Yo0I3GSJ4,How to Prep & French a Prime Rib #shorts,2021-12-23,Short,24S,24,6320856,261271,341
ESBJgrUdykY,Holiday Prime Rib (Thicc crust) #shorts,2021-12-19,Short,47S,47,3916663,323851,1366
5XC6GjfM7Os,I (kinda) got kicked out of Wendy’s parking lot #shorts,2021-12-15,Short,59S,59,135839584,7160764,16935
3_OArk8bZNU,CAR COOKING: Sleepover at Wendy's (Max vs Baconator) #shorts,2021-12-15,Short,1M,60,36328598,2908130,2571
F75zF9pjVUM,Dry Aged Striped Bass #shorts,2021-12-13,Short,33S,33,2251220,166543,781
fWH79nI3DFU,Car Cooking x Does it Deep Fry: McRib #shorts,2021-12-11,Short,39S,39,4172618,345410,752
kU_W_YIsFL4,The Tomahawk King (well done & rare) #shorts,2021-12-09,Short,48S,48,22689703,1422192,8868
lZI4IT2EbIc,The Old Fashioned: Orange & Whisky Dry Age #shorts,2021-12-03,Short,37S,37,2505287,210560,519
AJ3Py2n_cUY,The Ultimate Seafood Tower #shorts,2021-12-02,Short,59S,59,1179131,106810,398
DWgJ57LV4RE,Does it Deep Fry: Whole Duck #shorts,2021-12-01,Short,29S,29,3210817,184432,1353
y3I17q1I0UQ,Pulled Pork Cinnamon Rolls #shorts,2021-11-30,Short,29S,29,948154,83209,551
blDev_gChA4,$1 vs $100 bite - what does an 8 yr old like more? #shorts,2021-11-28,Short,50S,50,53237283,2889901,16094
-2exRhKYqRk,Green Dry Aged Turkey #shorts,2021-11-26,Short,36S,36,8719647,547999,2429
iuhIgUfRz0Y,Surf & Turf Sandwich #shorts,2021-11-25,Short,29S,29,2380107,172608,926
LJaj3E29N_4,The right way to carve a Turkey #shorts,2021-11-21,Short,31S,31,3152790,243063,458
KzWS_w6An1U,🍆 Wellington #shorts,2021-11-20,Short,16S,16,3049217,121552,826
WUGzlHBvm-E,Tomato Wellington 🍅 #shorts,2021-11-20,Short,16S,16,5747862,234070,1350
koNFDjyt6zw,The Perfect Thanksgiving Turkey #shorts,2021-11-17,Short,48S,48,5214454,321195,1817
i-15DZuO3u0,100 Day Dry Age Wagyu Beef Shank #shorts,2021-11-16,Short,1M,60,5697379,467044,1122
53gyRm319-c,The Turkey Wellington #shorts,2021-11-12,Short,44S,44,1878567,164950,641
5KLhlKMPKss,"Dry Aged Tuna Sushi ($4,000!!) #shorts",2021-11-11,Short,53S,53,30899294,1816444,6149
qc1aPTPIgvA,Bacon Wrapped Tomahawk #shorts,2021-11-09,Short,15S,15,2569341,133830,620
18lSwA77zcs,Sour patch kids dry age experiment (don't try this at home) #shorts,2021-11-06,Short,45S,45,8503729,578693,5856
sZKQVbWVNYI,Eating Duck with Mark Zuckerberg #shorts,2021-11-05,Short,1M,60,30485047,1796931,7912
Mh_IOsM88Ik,The Ostrich Egg Exploded Before I Could Slice It 🥲 #shorts,2021-11-01,Short,17S,17,18378644,424363,1865
fGEDb2lUWI4,Should you really cut steaks AGAINST the grain? (Real fire pit) #shorts,2021-10-26,Short,38S,38,12639687,756883,1697
SfkoDFjAZ8g,How I almost burned down my house #shorts,2021-10-25,Short,44S,44,3252288,243658,687
WXKp_11ehbQ,Pumpkin Spice Dry Aged Ribeye #shorts,2021-10-24,Short,37S,37,1732022,137334,483
BjHLQzkMJtw,Does it Deep Fry: Ice #shorts,2021-10-23,Short,24S,24,5001693,282430,1268
Cun-ny0N4dw,How I almost died buying my first smoker #shorts,2021-10-18,Short,47S,47,8327010,572507,3974
9cBVeyhW_SE,I dropped this steak in real dirt #shorts,2021-10-17,Short,11S,11,853735,42074,667
jrqt8aIvKDo,Steak School: New York Strip (Strip Steak) #shorts,2021-10-16,Short,32S,32,4472626,292602,606
sNsfvfEi27Y,Chocolate & Coffee Dry Aged Ribeye #shorts,2021-10-14,Short,40S,40,4334392,362990,1208
keAOhf4FFkQ,6 Steak Temps (Ketchup - Vampire) #shorts,2021-10-11,Short,39S,39,16366463,808727,12504
Hywmhl2eQlQ,Does it Deep Fry: Pork Belly #shorts,2021-10-09,Short,18S,18,7397661,403748,1760
6KrsRM5d_0s,The Steak Review: Longhorn #shorts,2021-10-06,Short,31S,31,3839926,280385,636
0AQ_eSNlH78,Turned 29 so cooked 🥩 #shorts,2021-10-02,Short,8S,8,10596333,370486,2480
MDJjWi0Wzh8,Steak Battles: Max vs Longhorn Steakhouse #shorts,2021-10-01,Short,44S,44,15241210,1292587,2319
DvawYzNvGbk,Steak of the Sea #shorts,2021-09-29,Short,11S,11,1306924,56879,423
MRWYEzIF3wM,Spicy Toro Crispy Rice #shorts,2021-09-28,Short,32S,32,745829,60662,334
H4lekFAtUZM,Grilled Lobster Roll x Truffle Fries #shorts,2021-09-25,Short,12S,12,1021255,58238,695
gEQeKJsAFSk,Team Medium Rare or Well Done? #shorts,2021-09-23,Short,29S,29,32562595,1275567,35949
hSg7OFHr1zo,Did I overreact eating the eyeball? #shorts,2021-09-22,Short,30S,30,3433011,186401,1892
_ndG_gpa3so,Pizza Wings #shorts,2021-09-20,Short,27S,27,2735517,181010,1807
0Bngto6HLh0,Beefsteak 🍅 #shorts,2021-09-16,Short,12S,12,12258420,373186,2479
9FpA4sHH-BA,The best way to cook a tomato #shorts,2021-09-16,Short,12S,12,15156187,625282,5837
fnXL_svhMoQ,Lamb & Peaches for Snoop Dogg #shorts,2021-09-12,Short,15S,15,1303914,64897,287
UKKxynoBO_w,Steak Battles: Max vs. Texas Roadhouse #shorts,2021-09-11,Short,29S,29,20459707,1328902,8533
sigPLhr_zFk,Dry Aged Wagyu Burger #shorts,2021-09-09,Short,28S,28,2705459,194565,1015
bv_mX6fbb38,Steak & Oysters #shorts,2021-09-06,Short,14S,14,5845651,245129,801
KsQeQ1nJOP4,Next Level Rib Corndogs #shorts,2021-09-04,Short,20S,20,2414153,184405,568
EbxQnE0d5Lc,Best “it’s raw” comment wins #shorts,2021-08-31,Short,9S,9,6321782,192834,19252
A3Tqm5k1IA4,Teriyaki WAGYU Burnt Ends #shorts,2021-08-29,Short,21S,21,1916112,112447,773
kUXXjApmS-E,Butter Basted Steak Tutorial #shorts,2021-08-27,Short,38S,38,5015624,333232,1417
xPl9Qf7UGWM,Vegan sister makes tuna #shorts,2021-08-23,Short,12S,12,7598248,227498,3628
PWrP6XwudJM,Watermelon tuna #shorts,2021-08-23,Short,12S,12,12695316,352702,3577
JU7q3vcEeM0,something's fishy #shorts,2021-08-21,Short,14S,14,1713698,64857,1290
4UwJhzIKbLw,Filet & Caprese #shorts,2021-08-13,Short,18S,18,1878761,97541,452
VtPsXzlzVNM,Black Truffle & Cognac Wagyu Ribeye #shorts,2021-08-09,Short,33S,33,5774634,402878,1462
zQyaFzqnoJQ,Beef Bacon Steak #shorts,2021-08-06,Short,26S,26,6374968,373510,1328
rBQFGw8li4c,How to make smoked watermelon taste good #shorts,2021-08-03,Short,13S,13,6737270,230821,1452
bG98sWNFymA,Never wrap with tinfoil... #shorts,2021-08-03,Short,13S,13,7598915,243000,1751
-Qp7n1It40c,Most Expensive Beef Jerky? #shorts,2021-07-28,Short,13S,13,4899407,253073,885
biZupXfvcYM,Prime Rib: Beef Bacon X Blue Cheese #shorts,2021-07-26,Short,53S,53,11551556,886856,3444
l07-1bHwBp4,Beef Bacon Burnt Ends #shorts,2021-07-21,Short,36S,36,4135866,314038,1176
YDTANv-7k7g,60 Day Dry Aged Picanha (Covered in frosting?) #shorts,2021-07-17,Short,31S,31,2197510,162147,431
K-jGQmngQEQ,Black Truffle Dry Brined Wagyu #shorts,2021-07-13,Short,30S,30,4265610,269736,1240
bwaM4sQS1Ek,Trimming a Dry Aged Brisket #shorts,2021-07-12,Short,40S,40,5741721,392258,975
rrhB85u122o,The Steak Review: The Outback #shorts,2021-07-10,Short,1M,60,7491789,616297,1299
IGwWbYE9cFs,Forbidden Dorito #shorts,2021-07-06,Short,12S,12,61788589,1208870,3702
W-x_iacztuQ,4th of July STEAK CAKE (& firework show) #shorts,2021-07-04,Short,34S,34,1019715,75456,851
XDL4e4969G8,Steak Battles: Max vs. The Outback #shorts,2021-07-01,Short,54S,54,22704753,1748067,5284
R86b_OuBXDk,Onion Volcano #shorts,2021-06-27,Short,12S,12,3409257,191028,792
6bCZhAKORW8,Chili Garlic Butter Oysters #shorts,2021-06-19,Short,13S,13,806953,42419,278
8x5fkS2xECU,Dry Aged Sea Bass Sashimi #shorts,2021-06-17,Short,26S,26,2337626,140328,631
UUOuTXn2REI,Bulgogi Beef Fried Rice #shorts,2021-06-16,Short,32S,32,3715801,259326,1893
XqQ6mqKajj0,Catch & Cook: Black Sea Bass CEVICHE #shorts,2021-06-12,Short,24S,24,1297624,68908,283
np_6Bt59Y80,Watermelon & Mustard: SHOCKING Results #shorts,2021-06-11,Short,12S,12,4104727,146357,1170
3imf3xPNh4g,Car Cooking: Wagyu A5 at Taco Bell #shorts,2021-06-09,Short,33S,33,10212631,695732,2201
ibF94yHR2Ug,TikTok said my meat looked dry #shorts,2021-06-08,Short,15S,15,2587106,117244,3277
eiM8zDAH8dw,The Surf & Turf Crayfish #shorts,2021-06-07,Short,29S,29,881112,61497,390
WaJW8Cvnr6g,5 Spice Ribs #shorts,2021-06-04,Short,23S,23,517245,35823,164
i7gA9w-Cxa0,How much meat do I eat? #shorts,2021-06-02,Short,31S,31,6040298,369881,1864
-b_PbTMbwF0,The 50 Day Dry Aged Brisket Sandwich #shorts,2021-05-27,Short,31S,31,8218970,416435,1638
jlQYv3hM0uQ,Whiskey Aged Steak #shorts,2021-05-25,Short,30S,30,11231971,607332,1524
04ECZ_Ohfi4,Steak School: Beef Tenderloin #shorts,2021-05-18,Short,52S,52,6079566,500743,1289
hIOb9b-xspc,Duck & A Story #shorts,2021-05-17,Short,31S,31,6530209,309424,1958
40FdljGsWOg,Wine Aged Ribeye #shorts,2021-05-13,Short,31S,31,2028394,138857,645
S8EzdS4nE0w,Honey Mustard Ribs #shorts,2021-05-11,Short,28S,28,541722,34851,293
H89U4ZZAQ5U,Candied Bacon X Bourbon Ribs #shorts,2021-05-06,Short,25S,25,668181,48339,227
DvnZ4ch99PY,Dry Aged Duck #shorts,2021-05-06,Short,25S,25,37357545,1037297,8628
EJh7o5AzqGU,All Aboard the Twisted Bacon Train #shorts,2021-04-30,Short,45S,45,3042728,195338,1758
XUW85TmLNJc,The Meat CHESS BOARD #shorts,2021-04-24,Short,31S,31,3098138,172292,1014
A24cBt35kLA,Duck CONFIT (date night food) #shorts,2021-04-22,Short,23S,23,857878,43251,270
ygP-cZdTIgQ,Wagyu Tomahawk… Pastrami? #shorts,2021-04-18,Short,30S,30,3409544,158918,746
XgmLWmc2IsI,Steak and a Story: Why I Started Social Media #shorts,2021-04-16,Short,43S,43,3676282,260476,1294
yOzjlNzka5w,Choose Your Meat Wisely #shorts,2021-04-13,Short,27S,27,14517037,460648,4626
7XYGcMlNWOY,Salmon Cinnamon Roll... but FANCY #shorts,2021-04-11,Short,46S,46,1144843,92079,540
LMWuaQbIoDI,A Guide To Dry Aging: Rib Roast Experiment #shorts,2021-04-08,Short,39S,39,1177972,90541,272
_QbmYhrzie0,The BASKETBALL Ham #shorts,2021-04-04,Short,57S,57,8142143,527179,2301
O1Sc8uw6UjM,Lamb Rack WELLINGTON for @gordonramsay #shorts,2021-03-30,Short,46S,46,1898342,157766,883
V7bTTaZn6Jg,Fitting a Chicken in a Sandwich #shorts,2021-03-26,Short,40S,40,5954307,286069,2282
E9ShGXo5Bww,King Crab JERKY #shorts,2021-03-23,Short,27S,27,2982319,149301,561
fPSQZ91RzTY,Steak School Pt. 2: Skirt Steak 101 #shorts,2021-03-21,Short,56S,56,1915840,146248,401
oozpaRAAY9g,WAGYU X Candied Bacon Compound Butter #shorts,2021-03-19,Short,42S,42,1557945,113615,741
iGhX600vU68,Car Cooking: WHOLE Chicken Chick-fil-A #shorts,2021-03-13,Short,41S,41,35705024,1953641,8248
htGQcQzy1Jw,Reverse Sear vs Direct Heat #shorts,2021-03-11,Short,31S,31,2106701,139520,545
FWsWKFUVN_o,King Crab Cake CUPCAKES #shorts,2021-03-11,Short,44S,44,291826,18347,228
z85irTkXMi8,Halloween STEAK CAKE Throwback #shorts,2021-03-10,Short,59S,59,543138,49532,473
LW3nSNGAA8M,DOUBLE CRUST Ribeye #shorts,2021-03-10,Short,59S,59,1600692,100699,573
rFD2BiMxnYU,WAGYU Beef Jerky? #shorts,2021-03-09,Short,53S,53,1413509,112803,726
r2o9WKXQ8Fc,Gordon Ramsay Wasn’t Happy With my Wellington! #shorts,2021-03-09,Short,53S,53,3140565,192984,1196
ycDG7tDhM7U,DINO Rib Confit x Duck Fat #shorts,2021-03-08,Short,36S,36,1422070,85269,478
N8coGPYDkBM,The SCORPION Beef Bomb #shorts,2021-03-08,Short,59S,59,2215979,149084,1605
GIR7dZyKUfo,Grilled STEAK Tutorial: Thin Cuts #shorts,2021-03-07,Short,59S,59,1607508,110012,705
6RbdIE6w_J4,Game changer Cinnamon Toast CRUNCH #shorts,2021-03-07,Short,43S,43,341053,22084,297
sdJLOQVh3Zk,Lobster and CAVIAR Bites #shorts,2021-03-06,Short,46S,46,668246,46918,378
sZr189j3THg,Bacon BREAD BLT: ASMR #shorts,2021-03-06,Short,16S,16,316379,14299,250
-Ou09DfmCgc,Doc Said Add FISH to My Diet #shorts,2021-03-05,Short,21S,21,832677,48613,611
Yfpl9RLbgOg,Car Cooking: The Filet-O-Fish #shorts,2021-03-04,Short,41S,41,24517209,1543431,7651
h-Ry_yTEKAI,Fresh MANGO Habanero Wangz #shorts,2021-03-03,Short,51S,51,338195,22688,161
G8RZKaoluAk,SQUIRREL TAIL Fish #shorts,2021-03-02,Short,42S,42,1475462,60277,760
B2i-PHENcJA,Oxtail DUMPLINGS #shorts,2021-02-28,Short,23S,23,667448,40568,496
p4elMv3PJOk,Taki Chicken Cordon BLUE #shorts,2021-02-28,Short,30S,30,1113626,51126,604
rsxpryCkHE0,Car Cooking: Fixing the IMPOSSIBLE Burger #shorts,2021-02-27,Short,41S,41,3480081,249758,1581
O55rt9_JAYA,Smoked Whiskey Glazed Pork Roast #shorts,2021-02-26,Short,44S,44,469001,31974,214
be0Cal-gs58,Using Snow to Cook a Better Porterhouse #shorts,2021-02-25,Short,37S,37,2122291,123903,543
Pg3ToNePSRA,Perfect Korean BEEF Marinade #shorts,2021-02-23,Short,30S,30,557652,27809,206
H8ejRXfIGPg,The IMMORTAL Hot Pocket pt. 2 #shorts,2021-02-22,Short,32S,32,545903,35894,337
j90UUvwLPKw,The HAMDOG #shorts,2021-02-21,Short,46S,46,3704965,266367,2485
D8-YO_NcPkQ,Sous Vide x Smoked x Smash BURGER #shorts,2021-02-21,Short,58S,58,3735345,304654,2075
0_N0fdXYaAA,Fresh Chili Lime WANGZ #shorts,2021-02-20,Short,54S,54,347193,23151,221
1QdWOB_OMj4,Leg of LAMB: ASMR #shorts,2021-02-18,Short,16S,16,374407,17845,206
ASYaBkUUMwQ,HABANERO Compound Butter ASMR #shorts,2021-02-17,Short,15S,15,448360,18901,183
fByMB8ukv7g,BOURBON Glazed Beer Can Turkey #shorts,2021-02-16,Short,16S,16,380101,14750,244
N6qLoOAHTU0,Steak School: Ribeye 101 in 60 Seconds #shorts,2021-02-15,Short,59S,59,1114816,65597,356
9aV5f6w3G5A,Bacon Wrapped GOOSE #shorts,2021-02-14,Short,52S,52,1788499,131568,1385
KbFrYwfC6Uo,Filet Mignon STEAK EXPERIMENT #shorts,2021-02-12,Short,54S,54,10596049,736606,2142
VYRHp1kg5UU,Jalapeño Smoked SALMON Dip (the perfect dip) #shorts,2021-02-11,Short,43S,43,490792,28860,257
-kA_6WG4meQ,The SUPER (Bacon & Queso) Bowl #shorts,2021-02-09,Short,58S,58,1740205,99807,698
NQFnpRx6Ajc,SALMON Bread #shorts,2021-02-07,Short,47S,47,5035628,322259,1936
8u_L6--738k,Car Cooking: The Oreo McFlurry #shorts,2021-02-04,Short,59S,59,35971092,2286879,7260
V5uvSbW-Y0o,The PORCHETTA Glizzy Wellington (pt4) #shorts,2021-02-04,Short,55S,55,1267296,69372,900
lCK6zrwnBGw,Smoked LOBSTER and Garlic Butter #shorts,2021-02-03,Short,30S,30,598104,33738,434
JvI42klX2so,Bacon STEAK #shorts,2021-02-02,Short,32S,32,1879205,116843,908
4cuGjdEQ11w,Is DRY BRINING Worth It? Steak Science #shorts,2021-02-01,Short,58S,58,1432904,71561,342
TduiEN47DIc,The IMMORTAL Hot Pocket pt1 #shorts,2021-01-31,Short,56S,56,2345841,133286,1035
d1ClvpNZycs,JUMBO Surf & Turf TEMPURA #shorts,2021-01-29,Short,40S,40,1080821,45183,467
bde4_GrdjMM,Honey Mustard x Ghost Pepper WANGZ #shorts,2021-01-27,Short,34S,34,607315,23814,354
9KgJDGLcWmw,CRUNCH WRAP Supreme #shorts,2021-01-25,Short,59S,59,4845823,322607,2326
feL8t43tLZA,The WAGYU Big Mac (Car Cooking pt4) #shorts,2021-01-24,Short,41S,41,17232021,915011,3662
hSD48Iop-Ms,Worlds Most EXPENSIVE Beef Jerky (A5 Wagyu Filet Mignon) #shorts,2021-01-23,Short,30S,30,2235731,88965,767
OxWnNyImzw4,BACON Bread: BLT & Salad Bowl #shorts,2021-01-23,Short,36S,36,864464,32001,632
WhTiePz20IU,The GOLDEN Goldfish #shorts,2021-01-22,Short,55S,55,1566599,53445,1044
BUP7MiEFrcU,Cooking BAMBI: ASMR #shorts,2021-01-22,Short,16S,16,1368829,40978,792
_x1rQpyQy4A,WAGYU Nachos #shorts,2021-01-21,Short,40S,40,1278247,65561,735
zNjnRDFKv8M,Salmon CANDY #shorts,2021-01-20,Short,33S,33,1092817,39409,614
cyrVgqAD6xc,Candied BACON x Ice Cream #shorts,2021-01-20,Short,35S,35,463115,23820,750
uNCxAk6ozPE,Tofu RIBS #shorts,2021-01-19,Short,44S,44,3139043,190036,3252
wJXmkEN2XrA,Golden GLIZZY Wellington! #shorts,2021-01-19,Short,58S,58,3598466,294190,1761
7MwM4I91o1Q,LOBSTER Hacks #shorts,2021-01-18,Short,15S,15,12087123,536584,1152
OfVHuqUGlyg,Hot dog OR Hamburger? #shorts,2021-01-18,Short,44S,44,1090794,45870,1423
U-Lk0uoMN7I,BACON Studded Smoked SALMON #shorts,2021-01-17,Short,58S,58,3111636,219529,1223
6kKfZQ8u4T8,Eating a 300 DAY Old Steak RAW #shorts,2021-01-17,Short,56S,56,32227537,1428915,13776
dOAyYRAPwr0,The GLIZZY Wellington Pt2 #shorts,2021-01-16,Short,58S,58,9396448,554013,3394
MWjQZ1Tx-20,The GLIZZY Wellington #shorts,2021-01-15,Short,51S,51,1768252,58145,1458
-K6E6U58zGE,LOBSTER x Grilled Cheese #shorts,2021-01-14,Short,56S,56,1697931,65403,1069
4IdSz2V4RF8,PORKLESS Salmon x Cinnamon Roll #shorts,2021-01-13,Short,51S,51,1434256,49430,944
oFhNJgWM6Y0,BRINGING THE MEATS to Arby’s: Car Cooking pt3 #shorts,2021-01-12,Short,31S,31,6468174,202629,1778
JWSZsYag6O4,Will it Wellington? CINNAMON ROLLS #shorts,2021-01-11,Short,31S,31,1374867,41316,1318
w8j9C0BbtDg,Swedish Fish #shorts,2021-01-10,Short,31S,31,1664301,48192,1066
YMrP85Olqa8,Surf & TURF Sushi #shorts,2021-01-09,Short,29S,29,1343269,45611,597
7VLkKClEug8,Hot Tub TUNA #shorts,2021-01-08,Short,26S,26,3416973,80890,1637
Z82F8XA68rc,Car Cooking pt2 THE McRIB #shorts,2021-01-06,Short,27S,27,7885061,302461,1552
w6fdVersAmg,Smoked Bacon S’MORE Bombs #shorts,2021-01-05,Short,53S,53,390635,16820,575
PN_1jWeLf2c,Ribs in a CORN DOG!! #shorts,2021-01-04,Short,32S,32,798998,32378,626
a42lVGMqACk,Garlic BOMBS! #shorts,2021-01-03,Short,32S,32,1078077,45676,583
GoofISdn2TQ,The PERFECT Bite: Bacon STUDDED Scallops & Caviar #shorts,2021-01-02,Short,39S,39,573380,20361,606
XD_O33aU9wU,FrankenSTEAK: Gluing a Filet to a Ribeye #shorts,2020-12-30,Short,29S,29,1527914,55732,657
6bXYJ4Z1Sc0,A5 Wagyu x PURPLE Cauliflower #shorts,2020-12-28,Short,46S,46,1419495,56912,1269
HZ-bqnA5ioQ,Grow a GLIZZY #shorts,2020-12-27,Short,47S,47,6515867,304292,5810
hXFVFkNy01o,Bacon Stuffed BUNS Triple Smash Burger #shorts,2020-12-26,Short,50S,50,1417118,85626,1031
DNaLdMOmSWw,SHREDDING a Wagyu Steak #shorts,2020-12-25,Short,51S,51,3378679,163332,1471
IInYY3tkshE,PRIME RIB Laced w/ Bacon & Blue Cheese #shorts,2020-12-25,Short,55S,55,1085373,58100,1000
ROxD5KeuPTU,Fresh EEL Sushi #shorts,2020-12-24,Short,50S,50,784232,25910,721
-4MKnJY-2hc,VENISON Rib Roast #shorts,2020-12-22,Short,55S,55,851472,37562,803
d7aB-aTdc4c,Black Hawk BEEF Bomb #shorts,2020-12-21,Short,56S,56,1543261,68197,1051
ja_Uw62RulA,Root Beer Glazed RIBS x Root Beer Float #shorts,2020-12-20,Short,33S,33,485676,22354,371
Lkx2dacy-PQ,LAMB Rack x Balsamic Blackberry Glaze #shorts,2020-12-19,Short,58S,58,567359,25099,468
hBd1FRlHczg,Smoked SALMON x Cinnamon Roll #shorts,2020-12-15,Short,55S,55,1797306,108319,1156
eqE0ag_XYsA,Will it Easy Bake: WAGYU A5 & Truffles #shorts,2020-12-15,Short,48S,48,800384,33826,674
xdSGOWKt_6o,Holiday Tree. Meat Galore. #shorts,2020-12-08,Short,59S,59,1472368,46902,2074
D1SeFPWNxss,Candied BACON: Chocolate x Sriracha #shorts,2020-12-06,Short,24S,24,396742,14928,286
ecxEdDh1GJ0,Boneless Wings EXPOSED #shorts,2020-12-03,Short,37S,37,7239652,259028,2330
wPm6qrUuvGI,Taco TWINKIE x Flaming Hot Mozzarella Stick #shorts,2020-11-30,Short,54S,54,1570208,62751,1098
OQ435x0Kf1s,The TURKEY FOOTBALL #shorts,2020-11-29,Short,59S,59,2920687,180215,2027
A9tZvbzU0zs,Will it EASY BAKE? pt2 Baby Back Ribs #shorts,2020-11-24,Short,44S,44,922098,44022,889
ya64LQKTGBs,Will it EASY BAKE? pt1 Ribeye and Potatoes 🥩🥔  #shorts,2020-11-20,Short,55S,55,3828264,198161,2132
MWLYWOtmJVY,The STEAK Cake 🥩 🎂 #shorts,2020-11-15,Short,52S,52,889575,39739,1340
5OLKyNq1aF0,3 Perfect STEAK Sauces 🥩,2020-11-13,Short,53S,53,2304019,100396,1113
AqqH_AEcJ8Q,The Pork PRETZEL 🐽 + 🥨,2020-11-10,Short,49S,49,2645073,141908,2591
IU_0YZ_Bshw,WELLINGTON Steak Cake! Happy Birthday Gordon Ramsay & Tilly Ramsay🥩🎂🥖,2020-11-08,Short,59S,59,5818168,340291,2755
MZ5z_XEM0M8,Prime Rib Laced With BACON 🥩🥓,2020-11-06,Short,59S,59,2286666,82318,1671
